{
  "dataset_id": "mars.msl.rems.modrdr-release41-sol4709",
  "source_id": "nasa-pds-msl-rems-modrdr-release41-sol4709",
  "target": "Mars",
  "processing_state": "ARCHIVED_DERIVED",
  "products": [
    {
      "product_id": "MSL_REMS_RDR_INDEX_RELEASE_0041",
      "property_id": "meteorology.rems_modrdr_index_row",
      "data_path": "resources/archive/nasa-pds-msl-rems-modrdr-sol4709/index.tab",
      "label_path": "resources/archive/nasa-pds-msl-rems-modrdr-sol4709/index.lbl",
      "record_count_method": "FIXED_BYTES",
      "record_bytes": 461,
      "records": 18276,
      "canonical_source_unit": null,
      "structure": {
        "format": "PDS3 fixed-length ASCII",
        "columns": 17,
        "release_id": "0041",
        "includes_dataset_ids": [
          "MSL-M-REMS-3-TELRDR-V1.0",
          "MSL-M-REMS-4-ENVRDR-V1.0",
          "MSL-M-REMS-5-MODRDR-V1.0",
          "MSL-M-REMS-6-ADR-V1.0"
        ]
      },
      "observation_period": "2012-08-07/2025-11-05",
      "notes": "Tam Release 0041 RDR dizinidir. Dizinlediği günlük veri ürünlerinin yalnız Sol 4709 MODRDR ürünü yerel arşivdedir."
    },
    {
      "product_id": "RME_815485151RMD47090000000_______P1",
      "property_id": "meteorology.rems_modrdr_observation_row",
      "data_path": "resources/archive/nasa-pds-msl-rems-modrdr-sol4709/rme_815485151rmd47090000000_p1.tab",
      "label_path": "resources/archive/nasa-pds-msl-rems-modrdr-sol4709/rme_815485151rmd47090000000_p1.lbl",
      "record_count_method": "FIXED_BYTES",
      "record_bytes": 372,
      "records": 34258,
      "canonical_source_unit": null,
      "structure": {
        "format": "PDS3 fixed-length ASCII",
        "planet_day_number": 4709,
        "columns": 40,
        "maximum_sampling_hz": 1,
        "missing_numeric_sentinel": -999.0,
        "column_groups": {
          "time": [1, 2, 3],
          "wind": [4, 5, 6, 7],
          "ground_temperature": [8, 9, 10, 11],
          "air_temperature": [12, 13, 14, 15, 16, 17],
          "ultraviolet": [18, 19, 20, 21, 22, 23, 24, 25, 26, 27, 28, 29, 30],
          "humidity": [31, 32, 33, 34, 35, 36],
          "pressure": [37, 38, 39, 40]
        },
        "source_units": {
          "wind_speed": "m/s",
          "wind_direction": "deg",
          "temperature": "K",
          "uv_irradiance": "W/m2",
          "relative_humidity": "%",
          "water_vapor_volume_mixing_ratio": "ppm",
          "pressure": "Pa"
        },
        "format_definition_path": "resources/archive/nasa-pds-msl-rems-modrdr-sol4709/modrdr6.fmt"
      },
      "observation_period": "2025-11-04T00:48:36.470/2025-11-05T00:32:56.288",
      "notes": "Curiosity rover konumunda bir Mars solu. MODRDR değerleri ölçüm, filtre, düzeltme ve bazı alanlarda model sonuçlarıdır. Her sensör alanı kendi güven koduyla kullanılmalı; -999.00 fiziksel değer değildir."
    }
  ]
}
