{
  "dataset_id": "mars.maven.iuvs.echelle-v13-v14-sample",
  "source_id": "nasa-pds-maven-iuvs-echelle-v13-v14-snapshot",
  "target": "Mars hydrogen and deuterium Lyman-alpha echelle observations",
  "processing_state": "ARCHIVED_DERIVED",
  "products": [
    {"product_id":"MAVEN_IUVS_CALIBRATED_ECHELLE_COLLECTION_LABEL_V13","property_id":"atmosphere.iuvs_echelle_calibrated_inventory_count","data_path":"resources/archive/nasa-pds-maven-iuvs-echelle-v13-v14-snapshot/collection_maven_iuvs_calibrated_echelle_inventory.tab","label_path":"resources/archive/nasa-pds-maven-iuvs-echelle-v13-v14-snapshot/collection_maven_iuvs_calibrated_echelle.xml","record_count_method":"TEXT_LINES","records":47106,"canonical_source_unit":"count","structure":{"format":"PDS4 collection inventory","fields":2,"collection_lid":"urn:nasa:pds:maven.iuvs.calibrated:echelle","collection_label_version":"13.0","member_versions":{"3.0":56,"13.0":3478,"14.0":42066,"14.1":1506}},"observation_period":"2014-10-18/2025-12-05","notes":"Koleksiyon etiketi V13.0 bildirirken envanter V14.0/V14.1 dahil karışık üye sürümleri içerir; bütün FITS üyeleri yerel değildir."},
    {"product_id":"MAVEN_IUVS_PROCESSED_ECHELLE_COLLECTION_LABEL_V13","property_id":"atmosphere.iuvs_echelle_processed_inventory_count","data_path":"resources/archive/nasa-pds-maven-iuvs-echelle-v13-v14-snapshot/collection_maven_iuvs_processed_echelle_inventory.tab","label_path":"resources/archive/nasa-pds-maven-iuvs-echelle-v13-v14-snapshot/collection_maven_iuvs_processed_echelle.xml","record_count_method":"TEXT_LINES","records":46662,"canonical_source_unit":"count","structure":{"format":"PDS4 collection inventory","fields":2,"collection_lid":"urn:nasa:pds:maven.iuvs.processed:echelle","collection_label_version":"13.0","member_versions":{"14.0":46662}},"observation_period":"2014-10-18/2025-12-05","notes":"Koleksiyon etiketi V13.0, bütün envanter üyeleri V14.0 bildirir; kaynak anomalisi korunur."},
    {"product_id":"MVN_IUV_L1C_OUTLIMB_ORBIT24914_ECH_PRIMARY","property_id":"atmosphere.iuvs_echelle_processed_image","data_path":"resources/archive/nasa-pds-maven-iuvs-echelle-v13-v14-snapshot/mvn_iuv_l1c_outlimb-orbit24914-ech_20251201T053547_v14_r01.fits","label_path":"resources/archive/nasa-pds-maven-iuvs-echelle-v13-v14-snapshot/mvn_iuv_l1c_outlimb-orbit24914-ech_20251201T053547.xml","record_count_method":"PDS_ARRAY_ELEMENTS","label_array_id":"data_Primary","records":196544,"canonical_source_unit":null,"structure":{"format":"FITS 3D image with detached PDS4 XML","axes":{"time":8,"line":74,"sample":332},"product_version":"14.0"},"observation_period":"2025-12-01T05:38:51.80Z/2025-12-01T05:42:50.80Z","notes":"Kaynak etiket ana görüntü dizisine birim vermez."},
    {"product_id":"MVN_IUV_L1C_OUTLIMB_ORBIT24914_ECH_INTEGRATION","property_id":"atmosphere.iuvs_echelle_integration_count","data_path":"resources/archive/nasa-pds-maven-iuvs-echelle-v13-v14-snapshot/mvn_iuv_l1c_outlimb-orbit24914-ech_20251201T053547_v14_r01.fits","label_path":"resources/archive/nasa-pds-maven-iuvs-echelle-v13-v14-snapshot/mvn_iuv_l1c_outlimb-orbit24914-ech_20251201T053547.xml","record_count_method":"PDS_TABLE_RECORDS","label_array_id":"data_INTEGRATION","records":8,"canonical_source_unit":"count","structure":{"format":"FITS binary table","fields":["TIMESTAMP","ET","UTC","MIRROR_DN","MIRROR_DEG","FOV_DEG","LYA_CENTROID","CASE_TEMP","DET_TEMP"]},"observation_period":"2025-12-01T05:38:51.80Z/2025-12-01T05:42:50.80Z","notes":null},
    {"product_id":"MVN_IUV_L1C_OUTLIMB_ORBIT24914_ECH_PIXELGEOMETRY","property_id":"atmosphere.iuvs_echelle_pixel_los_vector","data_path":"resources/archive/nasa-pds-maven-iuvs-echelle-v13-v14-snapshot/mvn_iuv_l1c_outlimb-orbit24914-ech_20251201T053547_v14_r01.fits","label_path":"resources/archive/nasa-pds-maven-iuvs-echelle-v13-v14-snapshot/mvn_iuv_l1c_outlimb-orbit24914-ech_20251201T053547.xml","record_count_method":"PDS_TABLE_RECORDS","label_array_id":"data_PIXELGEOMETRY","records":8,"canonical_source_unit":null,"structure":{"format":"FITS binary table","spatial_bins":74,"corners_and_center":5,"includes":["LOS vectors","RA/DEC","latitude/longitude","altitude","LOS distance","angles","local time"]},"observation_period":"2025-12-01T05:38:51.80Z/2025-12-01T05:42:50.80Z","notes":"V14 ile genişletilmiş piksel geometrisi."},
    {"product_id":"MVN_IUV_L1C_OUTLIMB_ORBIT24914_ECH_EMISSIONS","property_id":"atmosphere.iuvs_echelle_emission_feature","data_path":"resources/archive/nasa-pds-maven-iuvs-echelle-v13-v14-snapshot/mvn_iuv_l1c_outlimb-orbit24914-ech_20251201T053547_v14_r01.fits","label_path":"resources/archive/nasa-pds-maven-iuvs-echelle-v13-v14-snapshot/mvn_iuv_l1c_outlimb-orbit24914-ech_20251201T053547.xml","record_count_method":"PDS_TABLE_RECORDS","label_array_id":"data_EMISSIONS","records":2,"canonical_source_unit":null,"structure":{"format":"FITS binary table","values":["H_1215.67_Angstrom","D_1215.34_Angstrom"]},"observation_period":"2025-12-01T05:38:51.80Z/2025-12-01T05:42:50.80Z","notes":null},
    {"product_id":"MVN_IUV_L1C_OUTLIMB_ORBIT24914_ECH_BRIGHTNESSES","property_id":"atmosphere.iuvs_echelle_h_lya_brightness","data_path":"resources/archive/nasa-pds-maven-iuvs-echelle-v13-v14-snapshot/mvn_iuv_l1c_outlimb-orbit24914-ech_20251201T053547_v14_r01.fits","label_path":"resources/archive/nasa-pds-maven-iuvs-echelle-v13-v14-snapshot/mvn_iuv_l1c_outlimb-orbit24914-ech_20251201T053547.xml","record_count_method":"PDS_TABLE_RECORDS","label_array_id":"data_BRIGHTNESSES","records":8,"canonical_source_unit":"kR","structure":{"format":"FITS binary table","fields":["BRIGHT_H_KR","BRIGHT_D_KR","BRIGHT_DATA_PH_PER_SEC","BRIGHT_ONESIGMA_KR","MRH_ALTITUDE_KM","TANGENT_SZA_DEG","ET","LYMAN_ALPHA_WAVELENGTH_ANGSTROM","UTC"],"spectral_samples":332},"observation_period":"2025-12-01T05:38:51.80Z/2025-12-01T05:42:50.80Z","notes":"D parlaklığının ilk entegrasyonda negatif olması korunur; bu fiziksel negatif bolluk veya D/H değildir."},
    {"product_id":"MVN_IUV_L1C_OUTLIMB_ORBIT24914_ECH_OBSERVATION","property_id":"atmosphere.iuvs_echelle_wavelength_bin_center","data_path":"resources/archive/nasa-pds-maven-iuvs-echelle-v13-v14-snapshot/mvn_iuv_l1c_outlimb-orbit24914-ech_20251201T053547_v14_r01.fits","label_path":"resources/archive/nasa-pds-maven-iuvs-echelle-v13-v14-snapshot/mvn_iuv_l1c_outlimb-orbit24914-ech_20251201T053547.xml","record_count_method":"PDS_TABLE_RECORDS","label_array_id":"data_OBSERVATION","records":1,"canonical_source_unit":"nm","structure":{"format":"FITS binary table","spatial_bins":74,"spectral_bins":332,"fields":["product metadata","WAVELENGTH","WAVELENGTH_WIDTH","SPICE kernels"]},"observation_period":"2025-12-01T05:38:51.80Z/2025-12-01T05:42:50.80Z","notes":null}
  ]
}
