{
  "dataset_id": "mars.maven.iuvs.corona-v13-v07-sample",
  "source_id": "nasa-pds-maven-iuvs-corona-v13-v07-snapshot",
  "target": "Mars extended hydrogen and oxygen corona",
  "processing_state": "ARCHIVED_DERIVED",
  "products": [
    {"product_id":"MAVEN_IUVS_CALIBRATED_CORONA_COLLECTION_V13","property_id":"atmosphere.iuvs_corona_calibrated_inventory_count","data_path":"resources/archive/nasa-pds-maven-iuvs-corona-v13-v07-snapshot/collection_maven_iuvs_calibrated_corona_inventory.tab","label_path":"resources/archive/nasa-pds-maven-iuvs-corona-v13-v07-snapshot/collection_maven_iuvs_calibrated_corona.xml","record_count_method":"TEXT_LINES","records":18887,"canonical_source_unit":"count","structure":{"format":"PDS4 collection inventory","fields":2,"collection_lid":"urn:nasa:pds:maven.iuvs.calibrated:corona","version":"13.0"},"observation_period":"2014-10-18/2025-12-15","notes":"Tam üyelik envanteri yereldir; bütün FITS üyeleri yerel değildir."},
    {"product_id":"MAVEN_IUVS_PROCESSED_CORONA_COLLECTION_V7","property_id":"atmosphere.iuvs_corona_processed_inventory_count","data_path":"resources/archive/nasa-pds-maven-iuvs-corona-v13-v07-snapshot/collection_maven_iuvs_processed_corona_inventory.tab","label_path":"resources/archive/nasa-pds-maven-iuvs-corona-v13-v07-snapshot/collection_maven_iuvs_processed_corona.xml","record_count_method":"TEXT_LINES","records":496,"canonical_source_unit":"count","structure":{"format":"PDS4 collection inventory","fields":2,"collection_lid":"urn:nasa:pds:maven.iuvs.processed:corona","version":"7.0"},"observation_period":"2014-10-18/2016-07-30","notes":"V7 koleksiyonu 2016-07-30 sonrasında ürün içermez."},
    {"product_id":"MAVEN_IUVS_DERIVED_CORONA_COLLECTION_V7","property_id":"atmosphere.iuvs_corona_derived_inventory_count","data_path":"resources/archive/nasa-pds-maven-iuvs-corona-v13-v07-snapshot/collection_maven_iuvs_derived_corona_inventory.tab","label_path":"resources/archive/nasa-pds-maven-iuvs-corona-v13-v07-snapshot/collection_maven_iuvs_derived_corona.xml","record_count_method":"TEXT_LINES","records":496,"canonical_source_unit":"count","structure":{"format":"PDS4 collection inventory","fields":2,"collection_lid":"urn:nasa:pds:maven.iuvs.derived:corona","version":"7.0"},"observation_period":"2014-10-18/2016-07-30","notes":"V7 koleksiyonu 2016-07-30 sonrasında ürün içermez."},
    {"product_id":"MVN_IUV_L2_CORONA_ORBIT03558_OUTBOUND_ABOVE_LIMB","property_id":"atmosphere.iuvs_corona_scan_record","data_path":"resources/archive/nasa-pds-maven-iuvs-corona-v13-v07-snapshot/mvn_iuv_l2_corona-orbit03558-fuv_20160727T114312_v07_r01.fits","label_path":"resources/archive/nasa-pds-maven-iuvs-corona-v13-v07-snapshot/mvn_iuv_l2_corona-orbit03558-fuv_20160727T114312.xml","record_count_method":"PDS_TABLE_RECORDS","label_array_id":"data_outbound_above_limb","records":100,"canonical_source_unit":null,"structure":{"format":"FITS binary table with detached PDS4 XML","segment":"outbound_above_limb","species":["H","O"],"emissions":["H_1216","O_1304"],"includes_tangent_density":true},"observation_period":"2016-07-27T11:43:17.94Z/2016-07-27T14:38:02.90Z","notes":"Her kayıt iki tür/emisyon için sütun, yoğunluk, radyans, model ve geometri alanları taşır."},
    {"product_id":"MVN_IUV_L2_CORONA_ORBIT03558_INBOUND_ABOVE_LIMB","property_id":"atmosphere.iuvs_corona_scan_record","data_path":"resources/archive/nasa-pds-maven-iuvs-corona-v13-v07-snapshot/mvn_iuv_l2_corona-orbit03558-fuv_20160727T114312_v07_r01.fits","label_path":"resources/archive/nasa-pds-maven-iuvs-corona-v13-v07-snapshot/mvn_iuv_l2_corona-orbit03558-fuv_20160727T114312.xml","record_count_method":"PDS_TABLE_RECORDS","label_array_id":"data_inbound_above_limb","records":100,"canonical_source_unit":null,"structure":{"format":"FITS binary table with detached PDS4 XML","segment":"inbound_above_limb","species":["H","O"],"emissions":["H_1216","O_1304"],"includes_tangent_density":false},"observation_period":"2016-07-27T11:43:17.94Z/2016-07-27T14:38:02.90Z","notes":null},
    {"product_id":"MVN_IUV_L2_CORONA_ORBIT03558_INBOUND_BELOW_LIMB","property_id":"atmosphere.iuvs_corona_scan_record","data_path":"resources/archive/nasa-pds-maven-iuvs-corona-v13-v07-snapshot/mvn_iuv_l2_corona-orbit03558-fuv_20160727T114312_v07_r01.fits","label_path":"resources/archive/nasa-pds-maven-iuvs-corona-v13-v07-snapshot/mvn_iuv_l2_corona-orbit03558-fuv_20160727T114312.xml","record_count_method":"PDS_TABLE_RECORDS","label_array_id":"data_inbound_below_limb","records":64,"canonical_source_unit":null,"structure":{"format":"FITS binary table with detached PDS4 XML","segment":"inbound_below_limb","species":["H","O"],"emissions":["H_1216","O_1304"],"line_of_sight_intersects_ellipsoid":true},"observation_period":"2016-07-27T11:43:17.94Z/2016-07-27T14:38:02.90Z","notes":"Kaynak etikete göre teğet noktası konumu line-of-sight ellipsoidi keserse NaN olabilir."},
    {"product_id":"MVN_IUV_L2_CORONA_ORBIT03558_HYDROGEN_MODEL","property_id":"atmosphere.iuvs_corona_h_model_result_available","data_path":"resources/archive/nasa-pds-maven-iuvs-corona-v13-v07-snapshot/mvn_iuv_l2_corona-orbit03558-fuv_20160727T114312_v07_r01.fits","label_path":"resources/archive/nasa-pds-maven-iuvs-corona-v13-v07-snapshot/mvn_iuv_l2_corona-orbit03558-fuv_20160727T114312.xml","record_count_method":"PDS_TABLE_RECORDS","label_array_id":"data_hydrogen_model","records":1,"canonical_source_unit":null,"structure":{"format":"FITS binary table","fields":["EXOBASE_TEMP","EXOBASE_DENSITY","FIT_PARAM_UNC","FIT_QUAL","ESC_FLUX","GLOBAL_ESC_RATE"],"finite_physical_results":false,"fill":"IEEE NaN","fit_quality":[0.0,0.0,0.0]},"observation_period":"2016-07-27T11:43:17.94Z/2016-07-27T14:38:02.90Z","notes":"Ekzo-taban sıcaklığı/yoğunluğu ile kaçış akısı/hızı NaN'dır; fiziksel sonuç üretilmez."},
    {"product_id":"MVN_IUV_L2_CORONA_ORBIT03558_OXYGEN_MODEL","property_id":"atmosphere.iuvs_corona_o_model_result_available","data_path":"resources/archive/nasa-pds-maven-iuvs-corona-v13-v07-snapshot/mvn_iuv_l2_corona-orbit03558-fuv_20160727T114312_v07_r01.fits","label_path":"resources/archive/nasa-pds-maven-iuvs-corona-v13-v07-snapshot/mvn_iuv_l2_corona-orbit03558-fuv_20160727T114312.xml","record_count_method":"PDS_TABLE_RECORDS","label_array_id":"data_oxygen_model","records":1,"canonical_source_unit":null,"structure":{"format":"FITS binary table","fields":["E_MEAN_500KM","DR_RATE_200KM","DR_RATE_UNC","FIT_QUAL","ESC_FLUX","GLOBAL_ESC_RATE"],"finite_physical_results":false,"fill":"IEEE NaN"},"observation_period":"2016-07-27T11:43:17.94Z/2016-07-27T14:38:02.90Z","notes":"Bütün oksijen model alanları NaN'dır; fiziksel sonuç üretilmez."}
  ]
}
